ICD,Flag,ICDString,CCSCode,CCSString
E43,10,Unspecified severe protein-calorie malnutrition,52,Nutritional deficiencies
E45,10,Retarded development following protein-calorie malnutrition,52,Nutritional deficiencies
J22,10,Unspecified acute lower respiratory infection,133,Other lower respiratory disease
M53,10,"Other and unspecified dorsopathies, not elsewhere classified",205,Spondylosis; intervertebral disc disorders; other back problems
H65,10,Nonsuppurative otitis media,92,Otitis media and related conditions
O00,10,Ectopic pregnancy,180,Ectopic pregnancy
S02,10,Fracture of skull and facial bones,228,Skull and face fractures
S06,10,Intracranial injury,233,Intracranial injury
G53,10,Cranial nerve disorders in diseases classified elsewhere,95,Other nervous system disorders
G52,10,Disorders of other cranial nerves,95,Other nervous system disorders
O25,10,"Malnutrition in pregnancy, childbirth and the puerperium",181,Other complications of pregnancy
O9A,10,"Maternal malignant neoplasms, traumatic injuries and abuse classifiable elsewhere but complicating pregnancy, childbirth and the puerperium",181,Other complications of pregnancy
D50,10,Iron deficiency anemia,59,Deficiency and other anemia
N41,10,Inflammatory diseases of prostate,165,Inflammatory conditions of male genital organs
O23,10,Infections of genitourinary tract in pregnancy,181,Other complications of pregnancy
B44,10,Aspergillosis,4,Mycoses
J03,10,Acute tonsillitis,126,Other upper respiratory infections
R12,10,Heartburn,155,Other gastrointestinal disorders
N62,10,Hypertrophy of breast,167,Nonmalignant breast conditions
C22,10,Malignant neoplasm of liver and intrahepatic bile ducts,16,Cancer of liver and intrahepatic bile duct
C20,10,Malignant neoplasm of rectum,15,Cancer of rectum and anus
C19,10,Malignant neoplasm of rectosigmoid junction,15,Cancer of rectum and anus
K87,10,"Disorders of gallbladder, biliary tract and pancreas in diseases classified elsewhere",149,Biliary tract disease
K83,10,Other diseases of biliary tract,149,Biliary tract disease
T59,10,"Toxic effect of other gases, fumes and vapors",243,Poisoning by nonmedicinal substances
G91,10,Hydrocephalus,95,Other nervous system disorders
N17,10,Acute kidney failure,157,Acute and unspecified renal failure
L63,10,Alopecia areata,200,Other skin disorders
A78,10,Q fever,3,Bacterial infection; unspecified site
J14,10,Pneumonia due to Hemophilus influenzae,122,Pneumonia
K21,10,Gastro-esophageal reflux disease,138,Esophageal disorders
D73,10,Diseases of spleen,64,Other hematologic conditions
H51,10,Other disorders of binocular movement,91,Other eye disorders
J04,10,Acute laryngitis and tracheitis,126,Other upper respiratory infections
Q24,10,Other congenital malformations of heart,213,Cardiac and circulatory congenital anomalies
Q34,10,Other congenital malformations of respiratory system,217,Other congenital anomalies
Q32,10,Congenital malformations of trachea and bronchus,217,Other congenital anomalies
Q31,10,Congenital malformations of larynx,217,Other congenital anomalies
Q33,10,Congenital malformations of lung,217,Other congenital anomalies
K41,10,Femoral hernia,143,Abdominal hernia
C04,10,Malignant neoplasm of floor of mouth,11,Cancer of head and neck
C01,10,Malignant neoplasm of base of tongue,11,Cancer of head and neck
C02,10,Malignant neoplasm of other and unspecified parts of tongue,11,Cancer of head and neck
N91,10,"Absent, scanty and rare menstruation",171,Menstrual disorders
E70,10,Disorders of aromatic amino-acid metabolism,58,Other nutritional; endocrine; and metabolic disorders
Q65,10,Congenital deformities of hip,217,Other congenital anomalies
D01,10,Carcinoma in situ of other and unspecified digestive organs,14,Cancer of colon
H17,10,Corneal scars and opacities,91,Other eye disorders
H49,10,Paralytic strabismus,91,Other eye disorders
E26,10,Hyperaldosteronism,51,Other endocrine disorders
K57,10,Diverticular disease of intestine,146,Diverticulosis and diverticulitis
F32,10,"Major depressive disorder, single episode",657,Mood disorders
F33,10,"Major depressive disorder, recurrent",657,Mood disorders
Q62,10,Congenital obstructive defects of renal pelvis and congenital malformations of ureter,215,Genitourinary congenital anomalies
C56,10,Malignant neoplasm of ovary,27,Cancer of ovary
R27,10,Other lack of coordination,95,Other nervous system disorders
G24,10,Dystonia,81,Other hereditary and degenerative nervous system conditions
J66,10,Airway disease due to specific organic dust,132,Lung disease due to external agents
J67,10,Hypersensitivity pneumonitis due to organic dust,132,Lung disease due to external agents
N14,10,Drug- and heavy-metal-induced tubulo-interstitial and tubular conditions,156,Nephritis; nephrosis; renal sclerosis
N05,10,Unspecified nephritic syndrome,156,Nephritis; nephrosis; renal sclerosis
T86,10,Complications of transplanted organs and tissue,237,Complication of device; implant or graft
Y83,10,"Surgical operation and other surgical procedures as the cause of abnormal reaction of the patient, or of later complication, without mention of misadventure at the time of the procedure",2616,E Codes: Adverse effects of medical care
C50,10,Malignant neoplasm of breast,24,Cancer of breast
N23,10,Unspecified renal colic,160,Calculus of urinary tract
A71,10,Trachoma,90,Inflammation; infection of eye
H15,10,Disorders of sclera,90,Inflammation; infection of eye
H44,10,Disorders of globe,90,Inflammation; infection of eye
J35,10,Chronic diseases of tonsils and adenoids,124,Acute and chronic tonsillitis
H34,10,Retinal vascular occlusions,87,Retinal detachments; defects; vascular occlusion; and retinopathy
J37,10,Chronic laryngitis and laryngotracheitis,134,Other upper respiratory disease
G37,10,Other demyelinating diseases of central nervous system,95,Other nervous system disorders
G36,10,Other acute disseminated demyelination,95,Other nervous system disorders
E35,10,Disorders of endocrine glands in diseases classified elsewhere,51,Other endocrine disorders
E07,10,Other disorders of thyroid,48,Thyroid disorders
Q40,10,Other congenital malformations of upper alimentary tract,214,Digestive congenital anomalies
G06,10,Intracranial and intraspinal abscess and granuloma,78,Other CNS infection and poliomyelitis
G09,10,Sequelae of inflammatory diseases of central nervous system,78,Other CNS infection and poliomyelitis
A80,10,Acute poliomyelitis,78,Other CNS infection and poliomyelitis
B91,10,Sequelae of poliomyelitis,78,Other CNS infection and poliomyelitis
G14,10,Postpolio syndrome,78,Other CNS infection and poliomyelitis
G07,10,Intracranial and intraspinal abscess and granuloma in diseases classified elsewhere,78,Other CNS infection and poliomyelitis
I86,10,Varicose veins of other sites,121,Other diseases of veins and lymphatics
E56,10,Other vitamin deficiencies,52,Nutritional deficiencies
M65,10,Synovitis and tenosynovitis,211,Other connective tissue disease
Q02,10,Microcephaly,216,Nervous system congenital anomalies
Q06,10,Other congenital malformations of spinal cord,216,Nervous system congenital anomalies
Q03,10,Congenital hydrocephalus,216,Nervous system congenital anomalies
Q11,10,"Anophthalmos, microphthalmos and macrophthalmos",217,Other congenital anomalies
Q15,10,Other congenital malformations of eye,217,Other congenital anomalies
Q13,10,Congenital malformations of anterior segment of eye,217,Other congenital anomalies
F44,10,Dissociative and conversion disorders,670,Miscellaneous mental health disorders
J64,10,Unspecified pneumoconiosis,132,Lung disease due to external agents
J61,10,Pneumoconiosis due to asbestos and other mineral fibers,132,Lung disease due to external agents
J60,10,Coalworkers pneumoconiosis,132,Lung disease due to external agents
J63,10,Pneumoconiosis due to other inorganic dusts,132,Lung disease due to external agents
J62,10,Pneumoconiosis due to dust containing silica,132,Lung disease due to external agents
J65,10,Silicotuberculosis,1,Tuberculosis
S94,10,Injury of nerves at ankle and foot level,244,Other injuries and conditions due to external causes
S84,10,Injury of nerves at lower leg level,244,Other injuries and conditions due to external causes
S54,10,Injury of nerves at forearm level,244,Other injuries and conditions due to external causes
S44,10,Injury of nerves at shoulder and upper arm level,244,Other injuries and conditions due to external causes
S04,10,Injury of cranial nerve,244,Other injuries and conditions due to external causes
S64,10,Injury of nerves at wrist and hand level,244,Other injuries and conditions due to external causes
S74,10,Injury of nerves at hip and thigh level,244,Other injuries and conditions due to external causes
D62,10,Acute posthemorrhagic anemia,60,Acute posthemorrhagic anemia
I22,10,Subsequent ST elevation (STEMI) and non-ST elevation (NSTEMI) myocardial infarction,100,Acute myocardial infarction
I21,10,Acute myocardial infarction,100,Acute myocardial infarction
E25,10,Adrenogenital disorders,51,Other endocrine disorders
L64,10,Androgenic alopecia,200,Other skin disorders
L66,10,Cicatricial alopecia [scarring hair loss],200,Other skin disorders
C14,10,"Malignant neoplasm of other and ill-defined sites in the lip, oral cavity and pharynx",11,Cancer of head and neck
M50,10,Cervical disc disorders,205,Spondylosis; intervertebral disc disorders; other back problems
Q36,10,Cleft lip,217,Other congenital anomalies
Q37,10,Cleft palate with cleft lip,217,Other congenital anomalies
Q35,10,Cleft palate,217,Other congenital anomalies
G08,10,Intracranial and intraspinal phlebitis and thrombophlebitis,95,Other nervous system disorders
G81,10,Hemiplegia and hemiparesis,82,Paralysis
I69,10,Sequelae of cerebrovascular disease,113,Late effects of cerebrovascular disease
M1A,10,Chronic gout,54,Gout and other crystal arthropathies
X72,10,Intentional self-harm by handgun discharge,662,Suicide and intentional self-inflicted injury
X83,10,Intentional self-harm by other specified means,662,Suicide and intentional self-inflicted injury
X71,10,Intentional self-harm by drowning and submersion,662,Suicide and intentional self-inflicted injury
X81,10,Intentional self-harm by jumping or lying in front of moving object,662,Suicide and intentional self-inflicted injury
X73,10,"Intentional self-harm by rifle, shotgun and larger firearm discharge",662,Suicide and intentional self-inflicted injury
X82,10,Intentional self-harm by crashing of motor vehicle,662,Suicide and intentional self-inflicted injury
X80,10,Intentional self-harm by jumping from a high place,662,Suicide and intentional self-inflicted injury
X77,10,"Intentional self-harm by steam, hot vapors and hot objects",662,Suicide and intentional self-inflicted injury
X78,10,Intentional self-harm by sharp object,662,Suicide and intentional self-inflicted injury
X74,10,Intentional self-harm by other and unspecified firearm and gun discharge,662,Suicide and intentional self-inflicted injury
X76,10,"Intentional self-harm by smoke, fire and flames",662,Suicide and intentional self-inflicted injury
X79,10,Intentional self-harm by blunt object,662,Suicide and intentional self-inflicted injury
X75,10,Intentional self-harm by explosive material,662,Suicide and intentional self-inflicted injury
M23,10,Internal derangement of knee,225,Joint disorders and dislocations; trauma-related
M92,10,Other juvenile osteochondrosis,212,Other bone disease and musculoskeletal deformities
M91,10,Juvenile osteochondrosis of hip and pelvis,212,Other bone disease and musculoskeletal deformities
S57,10,Crushing injury of elbow and forearm,234,Crushing injury or internal injury
S67,10,"Crushing injury of wrist, hand and fingers",234,Crushing injury or internal injury
S77,10,Crushing injury of hip and thigh,234,Crushing injury or internal injury
S47,10,Crushing injury of shoulder and upper arm,234,Crushing injury or internal injury
S07,10,Crushing injury of head,234,Crushing injury or internal injury
S97,10,Crushing injury of ankle and foot,234,Crushing injury or internal injury
S17,10,Crushing injury of neck,234,Crushing injury or internal injury
S87,10,Crushing injury of lower leg,234,Crushing injury or internal injury
A38,10,Scarlet fever,3,Bacterial infection; unspecified site
P02,10,"Newborn affected by complications of placenta, cord and membranes",224,Other perinatal conditions
P00,10,Newborn affected by maternal conditions that may be unrelated to present pregnancy,224,Other perinatal conditions
Q86,10,"Congenital malformation syndromes due to known exogenous causes, not elsewhere classified",660,Alcohol-related disorders
P08,10,Disorders of newborn related to long gestation and high birth weight,224,Other perinatal conditions
P04,10,Newborn affected by noxious substances transmitted via placenta or breast milk,224,Other perinatal conditions
P01,10,Newborn affected by maternal complications of pregnancy,224,Other perinatal conditions
P03,10,Newborn affected by other complications of labor and delivery,224,Other perinatal conditions
H53,10,Visual disturbances,89,Blindness and vision defects
S12,10,Fracture of cervical vertebra and other parts of neck,231,Other fractures
M01,10,Direct infections of joint in infectious and parasitic diseases classified elsewhere,201,Infective arthritis and osteomyelitis
S10,10,Superficial injury of neck,239,Superficial injury; contusion
I25,10,Chronic ischemic heart disease,101,Coronary atherosclerosis and other heart disease
L90,10,Atrophic disorders of skin,200,Other skin disorders
L72,10,Follicular cysts of skin and subcutaneous tissue,200,Other skin disorders
T63,10,Toxic effect of contact with venomous animals and plants,243,Poisoning by nonmedicinal substances
K38,10,Other diseases of appendix,142,Appendicitis and other appendiceal conditions
K45,10,Other abdominal hernia,143,Abdominal hernia
N97,10,Female infertility,174,Female infertility
O40,10,Polyhydramnios,191,Polyhydramnios and other problems of amniotic cavity
O41,10,Other disorders of amniotic fluid and membranes,191,Polyhydramnios and other problems of amniotic cavity
O42,10,Premature rupture of membranes,191,Polyhydramnios and other problems of amniotic cavity
B65,10,Schistosomiasis [bilharziasis],8,Other infections; including parasitic
B74,10,Filariasis,8,Other infections; including parasitic
B66,10,Other fluke infections,8,Other infections; including parasitic
B73,10,Onchocerciasis,8,Other infections; including parasitic
B76,10,Hookworm diseases,8,Other infections; including parasitic
B82,10,Unspecified intestinal parasitism,8,Other infections; including parasitic
B72,10,Dracunculiasis,8,Other infections; including parasitic
E86,10,Volume depletion,55,Fluid and electrolyte disorders
J36,10,Peritonsillar abscess,124,Acute and chronic tonsillitis
K20,10,Esophagitis,138,Esophageal disorders
S25,10,Injury of blood vessels of thorax,234,Crushing injury or internal injury
S75,10,Injury of blood vessels at hip and thigh level,234,Crushing injury or internal injury
S45,10,Injury of blood vessels at shoulder and upper arm level,234,Crushing injury or internal injury
S15,10,Injury of blood vessels at neck level,234,Crushing injury or internal injury
S65,10,Injury of blood vessels at wrist and hand level,234,Crushing injury or internal injury
S55,10,Injury of blood vessels at forearm level,234,Crushing injury or internal injury
S95,10,Injury of blood vessels at ankle and foot level,234,Crushing injury or internal injury
S85,10,Injury of blood vessels at lower leg level,234,Crushing injury or internal injury
S35,10,"Injury of blood vessels at abdomen, lower back and pelvis level",234,Crushing injury or internal injury
O80,10,Encounter for full-term uncomplicated delivery,196,Other pregnancy and delivery including normal
O10,10,"Pre-existing hypertension complicating pregnancy, childbirth and the puerperium",183,Hypertension complicating pregnancy; childbirth and the puerperium
O16,10,Unspecified maternal hypertension,183,Hypertension complicating pregnancy; childbirth and the puerperium
O13,10,Gestational [pregnancy-induced] hypertension without significant proteinuria,183,Hypertension complicating pregnancy; childbirth and the puerperium
B27,10,Infectious mononucleosis,7,Viral infection
N29,10,Other disorders of kidney and ureter in diseases classified elsewhere,161,Other diseases of kidney and ureters
T50,10,"Poisoning by, adverse effect of and underdosing of diuretics and other and unspecified drugs, medicaments and biological substances",242,Poisoning by other medications and drugs
Z88,10,"Allergy status to drugs, medicaments and biological substances",253,Allergic reactions
H69,10,Other and unspecified disorders of Eustachian tube,92,Otitis media and related conditions
H68,10,Eustachian salpingitis and obstruction,92,Otitis media and related conditions
H35,10,Other retinal disorders,87,Retinal detachments; defects; vascular occlusion; and retinopathy
B38,10,Coccidioidomycosis,122,Pneumonia
L89,10,Pressure ulcer,199,Chronic ulcer of skin
A02,10,Other salmonella infections,135,Intestinal infection
A03,10,Shigellosis,135,Intestinal infection
C82,10,Follicular lymphoma,38,Non-Hodgkin`s lymphoma
G80,10,Cerebral palsy,82,Paralysis
I68,10,Cerebrovascular disorders in diseases classified elsewhere,111,Other and ill-defined cerebrovascular disease
B35,10,Dermatophytosis,4,Mycoses
T83,10,"Complications of genitourinary prosthetic devices, implants and grafts",237,Complication of device; implant or graft
G95,10,Other and unspecified diseases of spinal cord,95,Other nervous system disorders
R35,10,Polyuria,163,Genitourinary symptoms and ill-defined conditions
T32,10,Corrosions classified according to extent of body surface involved,240,Burns
T31,10,Burns classified according to extent of body surface involved,240,Burns
T26,10,Burn and corrosion confined to eye and adnexa,240,Burns
T22,10,"Burn and corrosion of shoulder and upper limb, except wrist and hand",240,Burns
T23,10,Burn and corrosion of wrist and hand,240,Burns
T30,10,"Burn and corrosion, body region unspecified",240,Burns
T24,10,"Burn and corrosion of lower limb, except ankle and foot",240,Burns
T21,10,Burn and corrosion of trunk,240,Burns
T25,10,Burn and corrosion of ankle and foot,240,Burns
T27,10,Burn and corrosion of respiratory tract,240,Burns
T20,10,"Burn and corrosion of head, face, and neck",240,Burns
T28,10,Burn and corrosion of other internal organs,240,Burns
B25,10,Cytomegaloviral disease,122,Pneumonia
A94,10,Unspecified arthropod-borne viral fever,7,Viral infection
A95,10,Yellow fever,7,Viral infection
A90,10,Dengue fever [classical dengue],7,Viral infection
A99,10,Unspecified viral hemorrhagic fever,7,Viral infection
B26,10,Mumps,7,Viral infection
B05,10,Measles,77,Encephalitis
A98,10,"Other viral hemorrhagic fevers, not elsewhere classified",7,Viral infection
A70,10,Chlamydia psittaci infections,3,Bacterial infection; unspecified site
B34,10,Viral infection of unspecified site,7,Viral infection
B04,10,Monkeypox,7,Viral infection
B06,10,Rubella [German measles],7,Viral infection
A82,10,Rabies,7,Viral infection
A92,10,Other mosquito-borne viral fevers,7,Viral infection
A93,10,"Other arthropod-borne viral fevers, not elsewhere classified",7,Viral infection
B03,10,Smallpox,7,Viral infection
A91,10,Dengue hemorrhagic fever,7,Viral infection
B09,10,Unspecified viral infection characterized by skin and mucous membrane lesions,7,Viral infection
A96,10,Arenaviral hemorrhagic fever,7,Viral infection
A68,10,Relapsing fevers,8,Other infections; including parasitic
A65,10,Nonvenereal syphilis,8,Other infections; including parasitic
A69,10,Other spirochetal infections,8,Other infections; including parasitic
A66,10,Yaws,8,Other infections; including parasitic
A27,10,Leptospirosis,8,Other infections; including parasitic
A67,10,Pinta [carate],8,Other infections; including parasitic
K44,10,Diaphragmatic hernia,143,Abdominal hernia
E11,10,Type 2 diabetes mellitus,50,Diabetes mellitus with complications
F69,10,Unspecified disorder of adult personality and behavior,658,Personality disorders
K51,10,Ulcerative colitis,144,Regional enteritis and ulcerative colitis
T79,10,"Certain early complications of trauma, not elsewhere classified",244,Other injuries and conditions due to external causes
C91,10,Lymphoid leukemia,39,Leukemias
K04,10,Diseases of pulp and periapical tissues,136,Disorders of teeth and jaw
Q30,10,Congenital malformations of nose,217,Other congenital anomalies
Q10,10,"Congenital malformations of eyelid, lacrimal apparatus and orbit",217,Other congenital anomalies
Q16,10,Congenital malformations of ear causing impairment of hearing,217,Other congenital anomalies
Q18,10,Other congenital malformations of face and neck,217,Other congenital anomalies
Q17,10,Other congenital malformations of ear,217,Other congenital anomalies
S72,10,Fracture of femur,226,Fracture of neck of femur (hip)
I05,10,Rheumatic mitral valve diseases,96,Heart valve disorders
I80,10,Phlebitis and thrombophlebitis,118,Phlebitis; thrombophlebitis and thromboembolism
N35,10,Urethral stricture,159,Urinary tract infections
T55,10,Toxic effect of soaps and detergents,243,Poisoning by nonmedicinal substances
T60,10,Toxic effect of pesticides,243,Poisoning by nonmedicinal substances
T65,10,Toxic effect of other and unspecified substances,243,Poisoning by nonmedicinal substances
T64,10,Toxic effect of aflatoxin and other mycotoxin food contaminants,243,Poisoning by nonmedicinal substances
G61,10,Inflammatory polyneuropathy,95,Other nervous system disorders
G65,10,Sequelae of inflammatory and toxic polyneuropathies,95,Other nervous system disorders
G63,10,Polyneuropathy in diseases classified elsewhere,95,Other nervous system disorders
G64,10,Other disorders of peripheral nervous system,95,Other nervous system disorders
R15,10,Fecal incontinence,155,Other gastrointestinal disorders
O03,10,Spontaneous abortion,177,Spontaneous abortion
O02,10,Other abnormal products of conception,181,Other complications of pregnancy
H55,10,Nystagmus and other irregular eye movements,91,Other eye disorders
S52,10,Fracture of forearm,229,Fracture of upper limb
W55,10,Contact with other mammals,2611,E Codes: Natural/environment
S40,10,Superficial injury of shoulder and upper arm,239,Superficial injury; contusion
S00,10,Superficial injury of head,239,Superficial injury; contusion
D29,10,Benign neoplasm of male genital organs,47,Other and unspecified benign neoplasm
E54,10,Ascorbic acid deficiency,52,Nutritional deficiencies
F01,10,Vascular dementia,653,Delirium
L97,10,"Non-pressure chronic ulcer of lower limb, not elsewhere classified",199,Chronic ulcer of skin
D10,10,Benign neoplasm of mouth and pharynx,47,Other and unspecified benign neoplasm
D11,10,Benign neoplasm of major salivary glands,47,Other and unspecified benign neoplasm
M46,10,Other inflammatory spondylopathies,205,Spondylosis; intervertebral disc disorders; other back problems
M49,10,Spondylopathies in diseases classified elsewhere,205,Spondylosis; intervertebral disc disorders; other back problems
Q98,10,"Other sex chromosome abnormalities, male phenotype, not elsewhere classified",217,Other congenital anomalies
Q91,10,Trisomy 18 and Trisomy 13,217,Other congenital anomalies
Q92,10,"Other trisomies and partial trisomies of the autosomes, not elsewhere classified",217,Other congenital anomalies
Q90,10,Down syndrome,217,Other congenital anomalies
Q96,10,Turners syndrome,217,Other congenital anomalies
Q95,10,"Balanced rearrangements and structural markers, not elsewhere classified",217,Other congenital anomalies
Q97,10,"Other sex chromosome abnormalities, female phenotype, not elsewhere classified",217,Other congenital anomalies
Q93,10,"Monosomies and deletions from the autosomes, not elsewhere classified",217,Other congenital anomalies
R55,10,Syncope and collapse,245,Syncope
T52,10,Toxic effect of organic solvents,243,Poisoning by nonmedicinal substances
T51,10,Toxic effect of alcohol,243,Poisoning by nonmedicinal substances
