ICD,Flag,ICDString,CCSCode,CCSString
K59,10,Other functional intestinal disorders,155,Other gastrointestinal disorders
K31,10,Other diseases of stomach and duodenum,141,Other disorders of stomach and duodenum
H05,10,Disorders of orbit,90,Inflammation; infection of eye
B37,10,Candidiasis,4,Mycoses
J85,10,Abscess of lung and mediastinum,248,Gangrene
A08,10,Viral and other specified intestinal infections,135,Intestinal infection
D60,10,Acquired pure red cell aplasia [erythroblastopenia],59,Deficiency and other anemia
F04,10,Amnestic disorder due to known physiological condition,653,Delirium
R54,10,Age-related physical debility,653,Delirium
K70,10,Alcoholic liver disease,660,Alcohol-related disorders
R43,10,Disturbances of smell and taste,95,Other nervous system disorders
M08,10,Juvenile arthritis,202,Rheumatoid arthritis and related disease
Q84,10,Other congenital malformations of integument,217,Other congenital anomalies
W59,10,Contact with other nonvenomous reptiles,2611,E Codes: Natural/environment
H11,10,Other disorders of conjunctiva,91,Other eye disorders
B20,10,Human immunodeficiency virus [HIV] disease,5,HIV infection
H73,10,Other disorders of tympanic membrane,92,Otitis media and related conditions
E67,10,Other hyperalimentation,58,Other nutritional; endocrine; and metabolic disorders
Q71,10,Reduction defects of upper limb,217,Other congenital anomalies
Q73,10,Reduction defects of unspecified limb,217,Other congenital anomalies
N46,10,Male infertility,166,Other male genital disorders
M17,10,Osteoarthritis of knee,203,Osteoarthritis
I07,10,Rheumatic tricuspid valve diseases,96,Heart valve disorders
K50,10,Crohns disease [regional enteritis],144,Regional enteritis and ulcerative colitis
M41,10,Scoliosis,212,Other bone disease and musculoskeletal deformities
G10,10,Huntingtons disease,81,Other hereditary and degenerative nervous system conditions
C43,10,Malignant melanoma of skin,22,Melanomas of skin
D03,10,Melanoma in situ,22,Melanomas of skin
D70,10,Neutropenia,63,Diseases of white blood cells
R31,10,Hematuria,163,Genitourinary symptoms and ill-defined conditions
P05,10,Disorders of newborn related to slow fetal growth and fetal malnutrition,219,Short gestation; low birth weight; and fetal growth retardation
F31,10,Bipolar disorder,657,Mood disorders
C61,10,Malignant neoplasm of prostate,29,Cancer of prostate
J92,10,Pleural plaque,130,Pleurisy; pneumothorax; pulmonary collapse
J94,10,Other pleural conditions,130,Pleurisy; pneumothorax; pulmonary collapse
J90,10,"Pleural effusion, not elsewhere classified",130,Pleurisy; pneumothorax; pulmonary collapse
N45,10,Orchitis and epididymitis,165,Inflammatory conditions of male genital organs
Q28,10,Other congenital malformations of circulatory system,213,Cardiac and circulatory congenital anomalies
E10,10,Type 1 diabetes mellitus,49,Diabetes mellitus without complication
G35,10,Multiple sclerosis,80,Multiple sclerosis
E09,10,Drug or chemical induced diabetes mellitus,50,Diabetes mellitus with complications
E08,10,Diabetes mellitus due to underlying condition,50,Diabetes mellitus with complications
I01,10,Rheumatic fever with heart involvement,97,Peri-; endo-; and myocarditis; cardiomyopathy
I09,10,Other rheumatic heart diseases,97,Peri-; endo-; and myocarditis; cardiomyopathy
J80,10,Acute respiratory distress syndrome,131,Respiratory failure; insufficiency; arrest (adult)
Q53,10,Undescended and ectopic testicle,215,Genitourinary congenital anomalies
Q54,10,Hypospadias,215,Genitourinary congenital anomalies
C23,10,Malignant neoplasm of gallbladder,18,Cancer of other GI organs; peritoneum
C24,10,Malignant neoplasm of other and unspecified parts of biliary tract,18,Cancer of other GI organs; peritoneum
I78,10,Diseases of capillaries,117,Other circulatory disease
S51,10,Open wound of elbow and forearm,236,Open wounds of extremities
S81,10,Open wound of knee and lower leg,236,Open wounds of extremities
S41,10,Open wound of shoulder and upper arm,236,Open wounds of extremities
S71,10,Open wound of hip and thigh,236,Open wounds of extremities
I50,10,Heart failure,108,Congestive heart failure; nonhypertensive
R83,10,Abnormal findings in cerebrospinal fluid,258,Other screening for suspected conditions
Z13,10,Encounter for screening for other diseases and disorders,258,Other screening for suspected conditions
C68,10,Malignant neoplasm of other and unspecified urinary organs,34,Cancer of other urinary organs
C66,10,Malignant neoplasm of ureter,34,Cancer of other urinary organs
Z41,10,Encounter for procedures for purposes other than remedying health state,224,Other perinatal conditions
Z18,10,Retained foreign body fragments,238,Complications of surgical procedures or medical care
Z01,10,"Encounter for other special examination without complaint, suspected or reported diagnosis",256,Medical examination/evaluation
Z45,10,Encounter for adjustment and management of implanted device,105,Conduction disorders
Z46,10,Encounter for fitting and adjustment of other devices,91,Other eye disorders
Z03,10,Encounter for medical observation for suspected diseases and conditions ruled out,10,Immunizations and screening for infectious disease
Z00,10,"Encounter for general examination without complaint, suspected or reported diagnosis",256,Medical examination/evaluation
Z53,10,"Persons encountering health services for specific procedures and treatment, not carried out",259,Residual codes; unclassified
Z40,10,Encounter for prophylactic surgery,259,Residual codes; unclassified
Z04,10,Encounter for examination and observation for other reasons,244,Other injuries and conditions due to external causes
Z17,10,Estrogen receptor status,259,Residual codes; unclassified
Z09,10,Encounter for follow-up examination after completed treatment for conditions other than malignant neoplasm,257,Other aftercare
Z08,10,Encounter for follow-up examination after completed treatment for malignant neoplasm,257,Other aftercare
R89,10,"Abnormal findings in specimens from other organs, systems and tissues",258,Other screening for suspected conditions
R94,10,Abnormal results of function studies,258,Other screening for suspected conditions
Z44,10,Encounter for fitting and adjustment of external prosthetic device,91,Other eye disorders
Z47,10,Orthopedic aftercare,257,Other aftercare
Z42,10,Encounter for plastic and reconstructive surgery following medical procedure or healed injury,257,Other aftercare
Z68,10,Body mass index [BMI],58,Other nutritional; endocrine; and metabolic disorders
Z02,10,Encounter for administrative examination,255,Administrative/social admission
Z49,10,Encounter for care involving renal dialysis,158,Chronic kidney disease
Z67,10,Blood type,259,Residual codes; unclassified
Z66,10,Do not resuscitate,259,Residual codes; unclassified
Z43,10,Encounter for attention to artificial openings,134,Other upper respiratory disease
Z52,10,Donors of organs and tissues,259,Residual codes; unclassified
Z48,10,Encounter for other postprocedural aftercare,257,Other aftercare
Z05,10,Encounter for observation and evaluation of newborn for suspected diseases and conditions ruled out,258,Other screening for suspected conditions
B18,10,Chronic viral hepatitis,6,Hepatitis
Z19,10,Hormone sensitivity malignancy status,259,Residual codes; unclassified
Z51,10,Encounter for other aftercare and medical care,45,Maintenance chemotherapy; radiotherapy
E20,10,Hypoparathyroidism,51,Other endocrine disorders
J31,10,"Chronic rhinitis, nasopharyngitis and pharyngitis",134,Other upper respiratory disease
J13,10,Pneumonia due to Streptococcus pneumoniae,122,Pneumonia
O85,10,Puerperal sepsis,195,Other complications of birth; puerperium affecting management of mother
H02,10,Other disorders of eyelid,91,Other eye disorders
J12,10,"Viral pneumonia, not elsewhere classified",122,Pneumonia
L68,10,Hypertrichosis,200,Other skin disorders
G23,10,Other degenerative diseases of basal ganglia,81,Other hereditary and degenerative nervous system conditions
H74,10,Other disorders of middle ear mastoid,92,Otitis media and related conditions
N19,10,Unspecified kidney failure,157,Acute and unspecified renal failure
F80,10,Specific developmental disorders of speech and language,654,Developmental disorders
M32,10,Systemic lupus erythematosus (SLE),210,Systemic lupus erythematosus and connective tissue disorders
A54,10,Gonococcal infection,9,Sexually transmitted infections
D28,10,Benign neoplasm of other and unspecified female genital organs,47,Other and unspecified benign neoplasm
B85,10,Pediculosis and phthiriasis,8,Other infections; including parasitic
G02,10,Meningitis in other infectious and parasitic diseases classified elsewhere,76,Meningitis
G03,10,Meningitis due to other and unspecified causes,76,Meningitis
A87,10,Viral meningitis,76,Meningitis
G01,10,Meningitis in bacterial diseases classified elsewhere,76,Meningitis
G00,10,"Bacterial meningitis, not elsewhere classified",76,Meningitis
E68,10,Sequelae of hyperalimentation,58,Other nutritional; endocrine; and metabolic disorders
J02,10,Acute pharyngitis,126,Other upper respiratory infections
P81,10,Other disturbances of temperature regulation of newborn,224,Other perinatal conditions
P80,10,Hypothermia of newborn,224,Other perinatal conditions
C49,10,Malignant neoplasm of other connective and soft tissue,21,Cancer of bone and connective tissue
C47,10,Malignant neoplasm of peripheral nerves and autonomic nervous system,35,Cancer of brain and nervous system
H36,10,Retinal disorders in diseases classified elsewhere,87,Retinal detachments; defects; vascular occlusion; and retinopathy
J68,10,"Respiratory conditions due to inhalation of chemicals, gases, fumes and vapors",132,Lung disease due to external agents
J70,10,Respiratory conditions due to other external agents,132,Lung disease due to external agents
T82,10,"Complications of cardiac and vascular prosthetic devices, implants and grafts",237,Complication of device; implant or graft
R30,10,Pain associated with micturition,163,Genitourinary symptoms and ill-defined conditions
I40,10,Acute myocarditis,97,Peri-; endo-; and myocarditis; cardiomyopathy
I41,10,Myocarditis in diseases classified elsewhere,97,Peri-; endo-; and myocarditis; cardiomyopathy
R37,10,"Sexual dysfunction, unspecified",670,Miscellaneous mental health disorders
F65,10,Paraphilias,670,Miscellaneous mental health disorders
F66,10,Other sexual disorders,670,Miscellaneous mental health disorders
N52,10,Male erectile dysfunction,166,Other male genital disorders
F64,10,Gender identity disorders,670,Miscellaneous mental health disorders
N03,10,Chronic nephritic syndrome,156,Nephritis; nephrosis; renal sclerosis
E63,10,Other nutritional deficiencies,52,Nutritional deficiencies
R60,10,"Edema, not elsewhere classified",259,Residual codes; unclassified
I38,10,"Endocarditis, valve unspecified",97,Peri-; endo-; and myocarditis; cardiomyopathy
I33,10,Acute and subacute endocarditis,97,Peri-; endo-; and myocarditis; cardiomyopathy
N40,10,Benign prostatic hyperplasia,164,Hyperplasia of prostate
J01,10,Acute sinusitis,126,Other upper respiratory infections
D83,10,Common variable immunodeficiency,57,Immunity disorders
H91,10,Other and unspecified hearing loss,94,Other ear and sense organ disorders
H90,10,Conductive and sensorineural hearing loss,94,Other ear and sense organ disorders
P72,10,Other transitory neonatal endocrine disorders,224,Other perinatal conditions
P71,10,Transitory neonatal disorders of calcium and magnesium metabolism,224,Other perinatal conditions
P70,10,Transitory disorders of carbohydrate metabolism specific to newborn,224,Other perinatal conditions
P92,10,Feeding problems of newborn,224,Other perinatal conditions
P74,10,Other transitory neonatal electrolyte and metabolic disturbances,224,Other perinatal conditions
L21,10,Seborrheic dermatitis,198,Other inflammatory condition of skin
T84,10,"Complications of internal orthopedic prosthetic devices, implants and grafts",237,Complication of device; implant or graft
I46,10,Cardiac arrest,107,Cardiac arrest and ventricular fibrillation
Q68,10,Other congenital musculoskeletal deformities,217,Other congenital anomalies
Q27,10,Other congenital malformations of peripheral vascular system,213,Cardiac and circulatory congenital anomalies
D04,10,Carcinoma in situ of skin,23,Other non-epithelial cancer of skin
G50,10,Disorders of trigeminal nerve,95,Other nervous system disorders
S88,10,Traumatic amputation of lower leg,236,Open wounds of extremities
S48,10,Traumatic amputation of shoulder and upper arm,236,Open wounds of extremities
S78,10,Traumatic amputation of hip and thigh,236,Open wounds of extremities
S98,10,Traumatic amputation of ankle and foot,236,Open wounds of extremities
S58,10,Traumatic amputation of elbow and forearm,236,Open wounds of extremities
S68,10,"Traumatic amputation of wrist, hand and fingers",236,Open wounds of extremities
H10,10,Conjunctivitis,90,Inflammation; infection of eye
S34,10,"Injury of lumbar and sacral spinal cord and nerves at abdomen, lower back and pelvis level",227,Spinal cord injury
S24,10,Injury of nerves and spinal cord at thorax level,227,Spinal cord injury
S14,10,Injury of nerves and spinal cord at neck level,227,Spinal cord injury
S26,10,Injury of heart,234,Crushing injury or internal injury
S27,10,Injury of other and unspecified intrathoracic organs,234,Crushing injury or internal injury
S36,10,Injury of intra-abdominal organs,234,Crushing injury or internal injury
S37,10,Injury of urinary and pelvic organs,234,Crushing injury or internal injury
B00,10,Herpesviral [herpes simplex] infections,7,Viral infection
A60,10,Anogenital herpesviral [herpes simplex] infections,7,Viral infection
J39,10,Other diseases of upper respiratory tract,134,Other upper respiratory disease
J99,10,Respiratory disorders in diseases classified elsewhere,133,Other lower respiratory disease
I31,10,Other diseases of pericardium,97,Peri-; endo-; and myocarditis; cardiomyopathy
N71,10,"Inflammatory disease of uterus, except cervix",168,Inflammatory diseases of female pelvic organs
D05,10,Carcinoma in situ of breast,24,Cancer of breast
K72,10,"Hepatic failure, not elsewhere classified",151,Other liver diseases
C53,10,Malignant neoplasm of cervix uteri,26,Cancer of cervix
L75,10,Apocrine sweat disorders,200,Other skin disorders
L74,10,Eccrine sweat disorders,200,Other skin disorders
N00,10,Acute nephritic syndrome,156,Nephritis; nephrosis; renal sclerosis
E65,10,Localized adiposity,58,Other nutritional; endocrine; and metabolic disorders
H04,10,Disorders of lacrimal system,90,Inflammation; infection of eye
B88,10,Other infestations,8,Other infections; including parasitic
B87,10,Myiasis,8,Other infections; including parasitic
B86,10,Scabies,8,Other infections; including parasitic
A46,10,Erysipelas,197,Skin and subcutaneous tissue infections
L08,10,Other local infections of skin and subcutaneous tissue,197,Skin and subcutaneous tissue infections
A26,10,Erysipeloid,3,Bacterial infection; unspecified site
R42,10,Dizziness and giddiness,93,Conditions associated with dizziness or vertigo
Q22,10,Congenital malformations of pulmonary and tricuspid valves,213,Cardiac and circulatory congenital anomalies
O30,10,Multiple gestation,188,Fetopelvic disproportion; obstruction
C93,10,Monocytic leukemia,39,Leukemias
J20,10,Acute bronchitis,125,Acute bronchitis
J21,10,Acute bronchiolitis,125,Acute bronchitis
L55,10,Sunburn,198,Other inflammatory condition of skin
K58,10,Irritable bowel syndrome,155,Other gastrointestinal disorders
E28,10,Ovarian dysfunction,51,Other endocrine disorders
D52,10,Folate deficiency anemia,59,Deficiency and other anemia
R51,10,Headache,84,Headache; including migraine
G44,10,Other headache syndromes,84,Headache; including migraine
K82,10,Other diseases of gallbladder,149,Biliary tract disease
N34,10,Urethritis and urethral syndrome,159,Urinary tract infections
Q80,10,Congenital ichthyosis,217,Other congenital anomalies
C06,10,Malignant neoplasm of other and unspecified parts of mouth,11,Cancer of head and neck
C05,10,Malignant neoplasm of palate,11,Cancer of head and neck
C62,10,Malignant neoplasm of testis,30,Cancer of testis
D36,10,Benign neoplasm of other and unspecified sites,47,Other and unspecified benign neoplasm
A17,10,Tuberculosis of nervous system,1,Tuberculosis
A15,10,Respiratory tuberculosis,1,Tuberculosis
A19,10,Miliary tuberculosis,1,Tuberculosis
A18,10,Tuberculosis of other organs,1,Tuberculosis
B90,10,Sequelae of tuberculosis,1,Tuberculosis
D27,10,Benign neoplasm of ovary,47,Other and unspecified benign neoplasm
K35,10,Acute appendicitis,142,Appendicitis and other appendiceal conditions
R20,10,Disturbances of skin sensation,95,Other nervous system disorders
O29,10,Complications of anesthesia during pregnancy,181,Other complications of pregnancy
O12,10,Gestational [pregnancy-induced] edema and proteinuria without hypertension,181,Other complications of pregnancy
K67,10,Disorders of peritoneum in infectious diseases classified elsewhere,148,Peritonitis and intestinal abscess
K65,10,Peritonitis,148,Peritonitis and intestinal abscess
N74,10,Female pelvic inflammatory disorders in diseases classified elsewhere,168,Inflammatory diseases of female pelvic organs
E16,10,Other disorders of pancreatic internal secretion,51,Other endocrine disorders
D57,10,Sickle-cell disorders,61,Sickle cell anemia
F54,10,Psychological and behavioral factors associated with disorders or diseases classified elsewhere,670,Miscellaneous mental health disorders
P51,10,Umbilical hemorrhage of newborn,224,Other perinatal conditions
P50,10,Newborn affected by intrauterine (fetal) blood loss,224,Other perinatal conditions
P54,10,Other neonatal hemorrhages,224,Other perinatal conditions
F50,10,Eating disorders,670,Miscellaneous mental health disorders
L29,10,Pruritus,198,Other inflammatory condition of skin
R33,10,Retention of urine,163,Genitourinary symptoms and ill-defined conditions
D09,10,Carcinoma in situ of other and unspecified sites,32,Cancer of bladder
G43,10,Migraine,84,Headache; including migraine
N82,10,Fistulae involving female genital tract,175,Other female genital disorders
F28,10,Other psychotic disorder not due to a substance or known physiological condition,659,Schizophrenia and other psychotic disorders
F29,10,Unspecified psychosis not due to a substance or known physiological condition,659,Schizophrenia and other psychotic disorders
H18,10,Other disorders of cornea,91,Other eye disorders
I61,10,Nontraumatic intracerebral hemorrhage,109,Acute cerebrovascular disease
D34,10,Benign neoplasm of thyroid gland,47,Other and unspecified benign neoplasm
K77,10,Liver disorders in diseases classified elsewhere,151,Other liver diseases
K76,10,Other diseases of liver,151,Other liver diseases
R01,10,Cardiac murmurs and other cardiac sounds,96,Heart valve disorders
L01,10,Impetigo,197,Skin and subcutaneous tissue infections
M83,10,Adult osteomalacia,52,Nutritional deficiencies
P78,10,Other perinatal digestive system disorders,224,Other perinatal conditions
P77,10,Necrotizing enterocolitis of newborn,224,Other perinatal conditions
P76,10,Other intestinal obstruction of newborn,224,Other perinatal conditions
J43,10,Emphysema,127,Chronic obstructive pulmonary disease and bronchiectasis
R61,10,Generalized hyperhidrosis,200,Other skin disorders
N75,10,Diseases of Bartholins gland,168,Inflammatory diseases of female pelvic organs
B39,10,Histoplasmosis,122,Pneumonia
E06,10,Thyroiditis,48,Thyroid disorders
Q14,10,Congenital malformations of posterior segment of eye,217,Other congenital anomalies
C81,10,Hodgkin lymphoma,37,Hodgkin`s disease
H43,10,Disorders of vitreous body,91,Other eye disorders
T68,10,Hypothermia,244,Other injuries and conditions due to external causes
Z16,10,Resistance to antimicrobial drugs,3,Bacterial infection; unspecified site
E50,10,Vitamin A deficiency,52,Nutritional deficiencies
M10,10,Gout,54,Gout and other crystal arthropathies
N53,10,Other male sexual dysfunction,166,Other male genital disorders
N51,10,Disorders of male genital organs in diseases classified elsewhere,166,Other male genital disorders
H25,10,Age-related cataract,86,Cataract
K64,10,Hemorrhoids and perianal venous thrombosis,120,Hemorrhoids
L40,10,Psoriasis,198,Other inflammatory condition of skin
I76,10,Septic arterial embolism,2,Septicemia (except in labor)
N36,10,Other disorders of urethra,162,Other diseases of bladder and urethra
L70,10,Acne,200,Other skin disorders
Z90,10,"Acquired absence of organs, not elsewhere classified",259,Residual codes; unclassified
J40,10,"Bronchitis, not specified as acute or chronic",127,Chronic obstructive pulmonary disease and bronchiectasis
O72,10,Postpartum hemorrhage,195,Other complications of birth; puerperium affecting management of mother
Q44,10,"Congenital malformations of gallbladder, bile ducts and liver",214,Digestive congenital anomalies
E29,10,Testicular dysfunction,51,Other endocrine disorders
F25,10,Schizoaffective disorders,659,Schizophrenia and other psychotic disorders
F20,10,Schizophrenia,659,Schizophrenia and other psychotic disorders
F90,10,Attention-deficit hyperactivity disorders,652,Attention-deficit
D49,10,Neoplasms of unspecified behavior,44,Neoplasms of unspecified nature or uncertain behavior
C80,10,Malignant neoplasm without specification of site,43,Malignant neoplasm without specification of site
C76,10,Malignant neoplasm of other and ill-defined sites,11,Cancer of head and neck
Z85,10,Personal history of malignant neoplasm,18,Cancer of other GI organs; peritoneum
R32,10,Unspecified urinary incontinence,163,Genitourinary symptoms and ill-defined conditions
M87,10,Osteonecrosis,212,Other bone disease and musculoskeletal deformities
O11,10,Pre-existing hypertension with pre-eclampsia,183,Hypertension complicating pregnancy; childbirth and the puerperium
O15,10,Eclampsia,183,Hypertension complicating pregnancy; childbirth and the puerperium
O14,10,Pre-eclampsia,183,Hypertension complicating pregnancy; childbirth and the puerperium
A64,10,Unspecified sexually transmitted disease,9,Sexually transmitted infections
A50,10,Congenital syphilis,9,Sexually transmitted infections
A55,10,Chlamydial lymphogranuloma (venereum),9,Sexually transmitted infections
A58,10,Granuloma inguinale,9,Sexually transmitted infections
A52,10,Late syphilis,9,Sexually transmitted infections
A51,10,Early syphilis,9,Sexually transmitted infections
A53,10,Other and unspecified syphilis,9,Sexually transmitted infections
A57,10,Chancroid,9,Sexually transmitted infections
C03,10,Malignant neoplasm of gum,11,Cancer of head and neck
D40,10,Neoplasm of uncertain behavior of male genital organs,44,Neoplasms of unspecified nature or uncertain behavior
G26,10,Extrapyramidal and movement disorders in diseases classified elsewhere,81,Other hereditary and degenerative nervous system conditions
G25,10,Other extrapyramidal and movement disorders,81,Other hereditary and degenerative nervous system conditions
C09,10,Malignant neoplasm of tonsil,11,Cancer of head and neck
C10,10,Malignant neoplasm of oropharynx,11,Cancer of head and neck
D77,10,Other disorders of blood and blood-forming organs in diseases classified elsewhere,64,Other hematologic conditions
C25,10,Malignant neoplasm of pancreas,17,Cancer of pancreas
F21,10,Schizotypal disorder,659,Schizophrenia and other psychotic disorders
E58,10,Dietary calcium deficiency,52,Nutritional deficiencies
E60,10,Dietary zinc deficiency,52,Nutritional deficiencies
E59,10,Dietary selenium deficiency,52,Nutritional deficiencies
M33,10,Dermatopolymyositis,210,Systemic lupus erythematosus and connective tissue disorders
V49,10,Car occupant injured in other and unspecified transport accidents,2607,E Codes: Motor vehicle traffic (MVT)
T88,10,"Other complications of surgical and medical care, not elsewhere classified",238,Complications of surgical procedures or medical care
N98,10,Complications associated with artificial fertilization,238,Complications of surgical procedures or medical care
P26,10,Pulmonary hemorrhage originating in the perinatal period,224,Other perinatal conditions
P27,10,Chronic respiratory disease originating in the perinatal period,224,Other perinatal conditions
L50,10,Urticaria,253,Allergic reactions
J42,10,Unspecified chronic bronchitis,127,Chronic obstructive pulmonary disease and bronchiectasis
J41,10,Simple and mucopurulent chronic bronchitis,127,Chronic obstructive pulmonary disease and bronchiectasis
C72,10,"Malignant neoplasm of spinal cord, cranial nerves and other parts of central nervous system",35,Cancer of brain and nervous system
C70,10,Malignant neoplasm of meninges,35,Cancer of brain and nervous system
E24,10,Cushings syndrome,51,Other endocrine disorders
I10,10,Essential (primary) hypertension,98,Essential hypertension
D42,10,Neoplasm of uncertain behavior of meninges,44,Neoplasms of unspecified nature or uncertain behavior
F99,10,"Mental disorder, not otherwise specified",670,Miscellaneous mental health disorders
I48,10,Atrial fibrillation and flutter,106,Cardiac dysrhythmias
J45,10,Asthma,128,Asthma
C31,10,Malignant neoplasm of accessory sinuses,11,Cancer of head and neck
H60,10,Otitis externa,94,Other ear and sense organ disorders
H62,10,Disorders of external ear in diseases classified elsewhere,94,Other ear and sense organ disorders
R11,10,Nausea and vomiting,250,Nausea and vomiting
I02,10,Rheumatic chorea,97,Peri-; endo-; and myocarditis; cardiomyopathy
I00,10,Rheumatic fever without heart involvement,3,Bacterial infection; unspecified site
C16,10,Malignant neoplasm of stomach,13,Cancer of stomach
E76,10,Disorders of glycosaminoglycan metabolism,58,Other nutritional; endocrine; and metabolic disorders
E77,10,Disorders of glycoprotein metabolism,58,Other nutritional; endocrine; and metabolic disorders
M86,10,Osteomyelitis,201,Infective arthritis and osteomyelitis
C63,10,Malignant neoplasm of other and unspecified male genital organs,31,Cancer of other male genital organs
C60,10,Malignant neoplasm of penis,31,Cancer of other male genital organs
