ICD,Flag,ICDString,CCSCode,CCSString
P14,10,Birth injury to peripheral nervous system,223,Birth trauma
P12,10,Birth injury to scalp,223,Birth trauma
P11,10,Other birth injuries to central nervous system,223,Birth trauma
O70,10,Perineal laceration during delivery,193,OB-related trauma to perineum and vulva
O71,10,Other obstetric trauma,195,Other complications of birth; puerperium affecting management of mother
P15,10,Other birth injuries,223,Birth trauma
F71,10,Moderate intellectual disabilities,654,Developmental disorders
F70,10,Mild intellectual disabilities,654,Developmental disorders
F79,10,Unspecified intellectual disabilities,654,Developmental disorders
F78,10,Other intellectual disabilities,654,Developmental disorders
F73,10,Profound intellectual disabilities,654,Developmental disorders
F72,10,Severe intellectual disabilities,654,Developmental disorders
G11,10,Hereditary ataxia,81,Other hereditary and degenerative nervous system conditions
N80,10,Endometriosis,169,Endometriosis
J18,10,"Pneumonia, unspecified organism",122,Pneumonia
L80,10,Vitiligo,200,Other skin disorders
L28,10,Lichen simplex chronicus and prurigo,198,Other inflammatory condition of skin
L43,10,Lichen planus,198,Other inflammatory condition of skin
D12,10,"Benign neoplasm of colon, rectum, anus and anal canal",47,Other and unspecified benign neoplasm
I70,10,Atherosclerosis,114,Peripheral and visceral atherosclerosis
C00,10,Malignant neoplasm of lip,11,Cancer of head and neck
A89,10,Unspecified viral infection of central nervous system,77,Encephalitis
A84,10,Tick-borne viral encephalitis,77,Encephalitis
G04,10,"Encephalitis, myelitis and encephalomyelitis",77,Encephalitis
A86,10,Unspecified viral encephalitis,77,Encephalitis
A85,10,"Other viral encephalitis, not elsewhere classified",77,Encephalitis
G05,10,"Encephalitis, myelitis and encephalomyelitis in diseases classified elsewhere",77,Encephalitis
A83,10,Mosquito-borne viral encephalitis,77,Encephalitis
I36,10,Nonrheumatic tricuspid valve disorders,96,Heart valve disorders
K63,10,Other diseases of intestine,148,Peritonitis and intestinal abscess
K55,10,Vascular disorders of intestine,114,Peripheral and visceral atherosclerosis
P57,10,Kernicterus,222,Hemolytic jaundice and perinatal jaundice
P56,10,Hydrops fetalis due to hemolytic disease,222,Hemolytic jaundice and perinatal jaundice
P55,10,Hemolytic disease of newborn,222,Hemolytic jaundice and perinatal jaundice
J32,10,Chronic sinusitis,126,Other upper respiratory infections
J11,10,Influenza due to unidentified influenza virus,123,Influenza
J10,10,Influenza due to other identified influenza virus,123,Influenza
J09,10,Influenza due to certain identified influenza viruses,123,Influenza
K23,10,Disorders of esophagus in diseases classified elsewhere,138,Esophageal disorders
Q41,10,"Congenital absence, atresia and stenosis of small intestine",214,Digestive congenital anomalies
Q42,10,"Congenital absence, atresia and stenosis of large intestine",214,Digestive congenital anomalies
Q43,10,Other congenital malformations of intestine,214,Digestive congenital anomalies
C48,10,Malignant neoplasm of retroperitoneum and peritoneum,18,Cancer of other GI organs; peritoneum
F10,10,Alcohol related disorders,660,Alcohol-related disorders
P37,10,Other congenital infectious and parasitic diseases,224,Other perinatal conditions
P36,10,Bacterial sepsis of newborn,2,Septicemia (except in labor)
P39,10,Other infections specific to the perinatal period,224,Other perinatal conditions
P38,10,Omphalitis of newborn,224,Other perinatal conditions
A33,10,Tetanus neonatorum,224,Other perinatal conditions
P35,10,Congenital viral diseases,224,Other perinatal conditions
I15,10,Secondary hypertension,99,Hypertension with complications and secondary hypertension
I16,10,Hypertensive crisis,99,Hypertension with complications and secondary hypertension
M30,10,Polyarteritis nodosa and related conditions,210,Systemic lupus erythematosus and connective tissue disorders
E79,10,Disorders of purine and pyrimidine metabolism,58,Other nutritional; endocrine; and metabolic disorders
N22,10,Calculus of urinary tract in diseases classified elsewhere,160,Calculus of urinary tract
N20,10,Calculus of kidney and ureter,160,Calculus of urinary tract
O32,10,Maternal care for malpresentation of fetus,187,Malposition; malpresentation
O64,10,Obstructed labor due to malposition and malpresentation of fetus,187,Malposition; malpresentation
N01,10,Rapidly progressive nephritic syndrome,156,Nephritis; nephrosis; renal sclerosis
M95,10,Other acquired deformities of musculoskeletal system and connective tissue,209,Other acquired deformities
D59,10,Acquired hemolytic anemia,59,Deficiency and other anemia
R80,10,Proteinuria,163,Genitourinary symptoms and ill-defined conditions
D69,10,Purpura and other hemorrhagic conditions,62,Coagulation and hemorrhagic disorders
R58,10,"Hemorrhage, not elsewhere classified",117,Other circulatory disease
L62,10,Nail disorders in diseases classified elsewhere,200,Other skin disorders
L60,10,Nail disorders,200,Other skin disorders
I13,10,Hypertensive heart and chronic kidney disease,99,Hypertension with complications and secondary hypertension
T54,10,Toxic effect of corrosive substances,243,Poisoning by nonmedicinal substances
K80,10,Cholelithiasis,149,Biliary tract disease
M63,10,Disorders of muscle in diseases classified elsewhere,211,Other connective tissue disease
C74,10,Malignant neoplasm of adrenal gland,41,Cancer; other and unspecified primary
C75,10,Malignant neoplasm of other endocrine glands and related structures,41,Cancer; other and unspecified primary
I12,10,Hypertensive chronic kidney disease,99,Hypertension with complications and secondary hypertension
L27,10,Dermatitis due to substances taken internally,253,Allergic reactions
L25,10,Unspecified contact dermatitis,253,Allergic reactions
L24,10,Irritant contact dermatitis,253,Allergic reactions
L23,10,Allergic contact dermatitis,253,Allergic reactions
L20,10,Atopic dermatitis,253,Allergic reactions
F45,10,Somatoform disorders,670,Miscellaneous mental health disorders
K95,10,Complications of bariatric procedures,238,Complications of surgical procedures or medical care
N04,10,Nephrotic syndrome,156,Nephritis; nephrosis; renal sclerosis
N11,10,Chronic tubulo-interstitial nephritis,159,Urinary tract infections
N12,10,"Tubulo-interstitial nephritis, not specified as acute or chronic",159,Urinary tract infections
N16,10,Renal tubulo-interstitial disorders in diseases classified elsewhere,161,Other diseases of kidney and ureters
N10,10,Acute tubulo-interstitial nephritis,159,Urinary tract infections
O98,10,"Maternal infectious and parasitic diseases classifiable elsewhere but complicating pregnancy, childbirth and the puerperium",181,Other complications of pregnancy
O91,10,"Infections of breast associated with pregnancy, the puerperium and lactation",181,Other complications of pregnancy
T71,10,Asphyxiation,244,Other injuries and conditions due to external causes
Q61,10,Cystic kidney disease,215,Genitourinary congenital anomalies
Q05,10,Spina bifida,216,Nervous system congenital anomalies
C71,10,Malignant neoplasm of brain,35,Cancer of brain and nervous system
C73,10,Malignant neoplasm of thyroid gland,36,Cancer of thyroid
E32,10,Diseases of thymus,51,Other endocrine disorders
I89,10,Other noninfective disorders of lymphatic vessels and lymph nodes,121,Other diseases of veins and lymphatics
C34,10,Malignant neoplasm of bronchus and lung,19,Cancer of bronchus; lung
C33,10,Malignant neoplasm of trachea,20,Cancer; other respiratory and intrathoracic
I26,10,Pulmonary embolism,103,Pulmonary heart disease
M81,10,Osteoporosis without current pathological fracture,206,Osteoporosis
E84,10,Cystic fibrosis,56,Cystic fibrosis
K46,10,Unspecified abdominal hernia,143,Abdominal hernia
P22,10,Respiratory distress of newborn,221,Respiratory distress syndrome
P84,10,Other problems with newborn,224,Other perinatal conditions
O62,10,Abnormalities of forces of labor,190,Fetal distress and abnormal forces of labor
O63,10,Long labor,190,Fetal distress and abnormal forces of labor
P19,10,Metabolic acidemia in newborn,220,Intrauterine hypoxia and birth asphyxia
C11,10,Malignant neoplasm of nasopharynx,11,Cancer of head and neck
K26,10,Duodenal ulcer,153,Gastrointestinal hemorrhage
N37,10,Urethral disorders in diseases classified elsewhere,159,Urinary tract infections
E15,10,Nondiabetic hypoglycemic coma,51,Other endocrine disorders
R56,10,"Convulsions, not elsewhere classified",83,Epilepsy; convulsions
J47,10,Bronchiectasis,127,Chronic obstructive pulmonary disease and bronchiectasis
R14,10,Flatulence and related conditions,155,Other gastrointestinal disorders
Z75,10,Problems related to medical facilities and other health care,255,Administrative/social admission
Z76,10,Persons encountering health services in other circumstances,255,Administrative/social admission
Z64,10,Problems related to certain psychosocial circumstances,255,Administrative/social admission
Z57,10,Occupational exposure to risk factors,255,Administrative/social admission
Z65,10,Problems related to other psychosocial circumstances,255,Administrative/social admission
Z56,10,Problems related to employment and unemployment,255,Administrative/social admission
Z74,10,Problems related to care provider dependency,255,Administrative/social admission
Z60,10,Problems related to social environment,255,Administrative/social admission
Z69,10,Encounter for mental health services for victim and perpetrator of abuse,255,Administrative/social admission
Z70,10,"Counseling related to sexual attitude, behavior and orientation",255,Administrative/social admission
Z62,10,Problems related to upbringing,255,Administrative/social admission
Z78,10,Other specified health status,259,Residual codes; unclassified
Z77,10,Other contact with and (suspected) exposures hazardous to health,259,Residual codes; unclassified
Z91,10,"Personal risk factors, not elsewhere classified",158,Chronic kidney disease
Z73,10,Problems related to life management difficulty,255,Administrative/social admission
Z71,10,"Persons encountering health services for other counseling and medical advice, not elsewhere classified",255,Administrative/social admission
Z79,10,Long term (current) drug therapy,173,Menopausal disorders
Z55,10,Problems related to education and literacy,255,Administrative/social admission
Z63,10,"Other problems related to primary support group, including family circumstances",255,Administrative/social admission
Z72,10,Problems related to lifestyle,259,Residual codes; unclassified
Z59,10,Problems related to housing and economic circumstances,255,Administrative/social admission
I35,10,Nonrheumatic aortic valve disorders,96,Heart valve disorders
D46,10,Myelodysplastic syndromes,44,Neoplasms of unspecified nature or uncertain behavior
C92,10,Myeloid leukemia,39,Leukemias
I75,10,Atheroembolism,116,Aortic and peripheral arterial embolism or thrombosis
O68,10,Labor and delivery complicated by abnormality of fetal acid-base balance,190,Fetal distress and abnormal forces of labor
O77,10,Other fetal stress complicating labor and delivery,195,Other complications of birth; puerperium affecting management of mother
K73,10,"Chronic hepatitis, not elsewhere classified",6,Hepatitis
L10,10,Pemphigus,198,Other inflammatory condition of skin
L12,10,Pemphigoid,198,Other inflammatory condition of skin
D18,10,"Hemangioma and lymphangioma, any site",47,Other and unspecified benign neoplasm
K85,10,Acute pancreatitis,152,Pancreatic disorders (not diabetes)
G94,10,Other disorders of brain in diseases classified elsewhere,95,Other nervous system disorders
J06,10,Acute upper respiratory infections of multiple and unspecified sites,126,Other upper respiratory infections
J00,10,Acute nasopharyngitis [common cold],126,Other upper respiratory infections
X17,10,"Contact with hot engines, machinery and tools",2604,E Codes: Fire/burn
X30,10,Exposure to excessive natural heat,2611,E Codes: Natural/environment
X37,10,Cataclysmic storm,2611,E Codes: Natural/environment
X13,10,Contact with steam and other hot vapors,2604,E Codes: Fire/burn
T34,10,Frostbite with tissue necrosis,244,Other injuries and conditions due to external causes
X36,10,"Avalanche, landslide and other earth movements",2611,E Codes: Natural/environment
W40,10,Explosion of other materials,2618,E Codes: Other specified and classifiable
X34,10,Earthquake,2611,E Codes: Natural/environment
X35,10,Volcanic eruption,2611,E Codes: Natural/environment
X18,10,Contact with other hot metals,2604,E Codes: Fire/burn
T69,10,Other effects of reduced temperature,244,Other injuries and conditions due to external causes
T70,10,Effects of air pressure and water pressure,244,Other injuries and conditions due to external causes
X32,10,Exposure to sunlight,2611,E Codes: Natural/environment
T33,10,Superficial frostbite,244,Other injuries and conditions due to external causes
X39,10,Exposure to other forces of nature,2611,E Codes: Natural/environment
X38,10,Flood,2611,E Codes: Natural/environment
X19,10,Contact with other heat and hot substances,2604,E Codes: Fire/burn
X31,10,Exposure to excessive natural cold,2611,E Codes: Natural/environment
T67,10,Effects of heat and light,244,Other injuries and conditions due to external causes
X16,10,"Contact with hot heating appliances, radiators and pipes",2604,E Codes: Fire/burn
X10,10,"Contact with hot drinks, food, fats and cooking oils",2604,E Codes: Fire/burn
X12,10,Contact with other hot fluids,2604,E Codes: Fire/burn
X14,10,Contact with hot air and other hot gases,2604,E Codes: Fire/burn
X15,10,Contact with hot household appliances,2604,E Codes: Fire/burn
X11,10,Contact with hot tap-water,2604,E Codes: Fire/burn
M47,10,Spondylosis,205,Spondylosis; intervertebral disc disorders; other back problems
S01,10,Open wound of head,235,Open wounds of head; neck; and trunk
O46,10,"Antepartum hemorrhage, not elsewhere classified",182,Hemorrhage during pregnancy; abruptio placenta; placenta previa
O45,10,Premature separation of placenta [abruptio placentae],182,Hemorrhage during pregnancy; abruptio placenta; placenta previa
O43,10,Placental disorders,181,Other complications of pregnancy
O44,10,Placenta previa,182,Hemorrhage during pregnancy; abruptio placenta; placenta previa
O67,10,"Labor and delivery complicated by intrapartum hemorrhage, not elsewhere classified",182,Hemorrhage during pregnancy; abruptio placenta; placenta previa
L58,10,Radiodermatitis,253,Allergic reactions
L59,10,Other disorders of skin and subcutaneous tissue related to radiation,253,Allergic reactions
B30,10,Viral conjunctivitis,90,Inflammation; infection of eye
R86,10,Abnormal findings in specimens from male genital organs,258,Other screening for suspected conditions
D67,10,Hereditary factor IX deficiency,62,Coagulation and hemorrhagic disorders
E85,10,Amyloidosis,58,Other nutritional; endocrine; and metabolic disorders
J82,10,"Pulmonary eosinophilia, not elsewhere classified",133,Other lower respiratory disease
K02,10,Dental caries,136,Disorders of teeth and jaw
R53,10,Malaise and fatigue,252,Malaise and fatigue
R22,10,"Localized swelling, mass and lump of skin and subcutaneous tissue",200,Other skin disorders
A30,10,Leprosy [Hansens disease],3,Bacterial infection; unspecified site
C95,10,Leukemia of unspecified cell type,39,Leukemias
K40,10,Inguinal hernia,143,Abdominal hernia
L84,10,Corns and callosities,200,Other skin disorders
R97,10,Abnormal tumor markers,258,Other screening for suspected conditions
N65,10,Deformity and disproportion of reconstructed breast,167,Nonmalignant breast conditions
D20,10,Benign neoplasm of soft tissue of retroperitoneum and peritoneum,47,Other and unspecified benign neoplasm
D13,10,Benign neoplasm of other and ill-defined parts of digestive system,47,Other and unspecified benign neoplasm
I52,10,Other heart disorders in diseases classified elsewhere,104,Other and ill-defined heart disease
L22,10,Diaper dermatitis,253,Allergic reactions
M00,10,Pyogenic arthritis,201,Infective arthritis and osteomyelitis
D25,10,Leiomyoma of uterus,46,Benign neoplasm of uterus
R00,10,Abnormalities of heart beat,106,Cardiac dysrhythmias
O09,10,Supervision of high risk pregnancy,181,Other complications of pregnancy
N27,10,Small kidney of unknown cause,161,Other diseases of kidney and ureters
N26,10,Unspecified contracted kidney,99,Hypertension with complications and secondary hypertension
L49,10,Exfoliation due to erythematous conditions according to extent of body surface involved,198,Other inflammatory condition of skin
M54,10,Dorsalgia,205,Spondylosis; intervertebral disc disorders; other back problems
F84,10,Pervasive developmental disorders,655,Disorders usually diagnosed in infancy
Q75,10,Other congenital malformations of skull and face bones,217,Other congenital anomalies
E00,10,Congenital iodine-deficiency syndrome,48,Thyroid disorders
J98,10,Other respiratory disorders,130,Pleurisy; pneumothorax; pulmonary collapse
A40,10,Streptococcal sepsis,2,Septicemia (except in labor)
K00,10,Disorders of tooth development and eruption,136,Disorders of teeth and jaw
D71,10,Functional disorders of polymorphonuclear neutrophils,63,Diseases of white blood cells
D76,10,Other specified diseases with participation of lymphoreticular and reticulohistiocytic tissue,63,Diseases of white blood cells
K25,10,Gastric ulcer,153,Gastrointestinal hemorrhage
C17,10,Malignant neoplasm of small intestine,18,Cancer of other GI organs; peritoneum
L14,10,Bullous disorders in diseases classified elsewhere,198,Other inflammatory condition of skin
R21,10,Rash and other nonspecific skin eruption,200,Other skin disorders
F39,10,Unspecified mood [affective] disorder,657,Mood disorders
I34,10,Nonrheumatic mitral valve disorders,96,Heart valve disorders
G92,10,Toxic encephalopathy,95,Other nervous system disorders
G98,10,Other disorders of nervous system not elsewhere classified,95,Other nervous system disorders
G96,10,Other disorders of central nervous system,95,Other nervous system disorders
G21,10,Secondary parkinsonism,95,Other nervous system disorders
I20,10,Angina pectoris,101,Coronary atherosclerosis and other heart disease
I73,10,Other peripheral vascular diseases,117,Other circulatory disease
I28,10,Other diseases of pulmonary vessels,103,Pulmonary heart disease
C15,10,Malignant neoplasm of esophagus,12,Cancer of esophagus
N32,10,Other disorders of bladder,162,Other diseases of bladder and urethra
N33,10,Bladder disorders in diseases classified elsewhere,162,Other diseases of bladder and urethra
Q39,10,Congenital malformations of esophagus,214,Digestive congenital anomalies
X58,10,Exposure to other specified factors,2611,E Codes: Natural/environment
T74,10,"Adult and child abuse, neglect and other maltreatment, confirmed",244,Other injuries and conditions due to external causes
T73,10,Effects of other deprivation,244,Other injuries and conditions due to external causes
T75,10,Other and unspecified effects of other external causes,244,Other injuries and conditions due to external causes
W19,10,Unspecified fall,2603,E Codes: Fall
T78,10,"Adverse effects, not elsewhere classified",244,Other injuries and conditions due to external causes
T76,10,"Adult and child abuse, neglect and other maltreatment, suspected",244,Other injuries and conditions due to external causes
C86,10,Other specified types of T/NK-cell lymphoma,38,Non-Hodgkin`s lymphoma
C84,10,Mature T/NK-cell lymphomas,38,Non-Hodgkin`s lymphoma
C85,10,Other specified and unspecified types of non-Hodgkin lymphoma,38,Non-Hodgkin`s lymphoma
E05,10,Thyrotoxicosis [hyperthyroidism],48,Thyroid disorders
H27,10,Other disorders of lens,91,Other eye disorders
K61,10,Abscess of anal and rectal regions,147,Anal and rectal conditions
K60,10,Fissure and fistula of anal and rectal regions,147,Anal and rectal conditions
N18,10,Chronic kidney disease (CKD),158,Chronic kidney disease
A07,10,Other protozoal intestinal diseases,135,Intestinal infection
A09,10,"Infectious gastroenteritis and colitis, unspecified",135,Intestinal infection
A06,10,Amebiasis,135,Intestinal infection
A00,10,Cholera,135,Intestinal infection
A01,10,Typhoid and paratyphoid fevers,135,Intestinal infection
D41,10,Neoplasm of uncertain behavior of urinary organs,44,Neoplasms of unspecified nature or uncertain behavior
D38,10,Neoplasm of uncertain behavior of middle ear and respiratory and intrathoracic organs,44,Neoplasms of unspecified nature or uncertain behavior
D44,10,Neoplasm of uncertain behavior of endocrine glands,44,Neoplasms of unspecified nature or uncertain behavior
P61,10,Other perinatal hematological disorders,224,Other perinatal conditions
P60,10,Disseminated intravascular coagulation of newborn,224,Other perinatal conditions
P53,10,Hemorrhagic disease of newborn,224,Other perinatal conditions
D17,10,Benign lipomatous neoplasm,47,Other and unspecified benign neoplasm
D21,10,Other benign neoplasms of connective and other soft tissue,47,Other and unspecified benign neoplasm
D19,10,Benign neoplasm of mesothelial tissue,47,Other and unspecified benign neoplasm
F93,10,Emotional disorders with onset specific to childhood,655,Disorders usually diagnosed in infancy
P25,10,Interstitial emphysema and related conditions originating in the perinatal period,224,Other perinatal conditions
L54,10,Erythema in diseases classified elsewhere,198,Other inflammatory condition of skin
L26,10,Exfoliative dermatitis,198,Other inflammatory condition of skin
L00,10,Staphylococcal scalded skin syndrome,198,Other inflammatory condition of skin
E02,10,Subclinical iodine-deficiency hypothyroidism,48,Thyroid disorders
L57,10,Skin changes due to chronic exposure to nonionizing radiation,200,Other skin disorders
F59,10,Unspecified behavioral syndromes associated with physiological disturbances and physical factors,670,Miscellaneous mental health disorders
N61,10,Inflammatory disorders of breast,167,Nonmalignant breast conditions
R81,10,Glycosuria,49,Diabetes mellitus without complication
I47,10,Paroxysmal tachycardia,106,Cardiac dysrhythmias
O47,10,False labor,184,Early or threatened labor
R05,10,Cough,133,Other lower respiratory disease
H01,10,Other inflammation of eyelid,90,Inflammation; infection of eye
C52,10,Malignant neoplasm of vagina,28,Cancer of other female genital organs
D39,10,Neoplasm of uncertain behavior of female genital organs,44,Neoplasms of unspecified nature or uncertain behavior
C51,10,Malignant neoplasm of vulva,28,Cancer of other female genital organs
D15,10,Benign neoplasm of other and unspecified intrathoracic organs,47,Other and unspecified benign neoplasm
D14,10,Benign neoplasm of middle ear and respiratory system,47,Other and unspecified benign neoplasm
M61,10,Calcification and ossification of muscle,211,Other connective tissue disease
I99,10,Other and unspecified disorders of circulatory system,117,Other circulatory disease
I06,10,Rheumatic aortic valve diseases,96,Heart valve disorders
H72,10,Perforation of tympanic membrane,92,Otitis media and related conditions
T87,10,Complications peculiar to reattachment and amputation,237,Complication of device; implant or graft
R36,10,Urethral discharge,163,Genitourinary symptoms and ill-defined conditions
B01,10,Varicella [chickenpox],76,Meningitis
N25,10,Disorders resulting from impaired renal tubular function,161,Other diseases of kidney and ureters
M45,10,Ankylosing spondylitis,202,Rheumatoid arthritis and related disease
B16,10,Acute hepatitis B,6,Hepatitis
D16,10,Benign neoplasm of bone and articular cartilage,47,Other and unspecified benign neoplasm
Q72,10,Reduction defects of lower limb,217,Other congenital anomalies
T15,10,Foreign body on external eye,244,Other injuries and conditions due to external causes
T17,10,Foreign body in respiratory tract,244,Other injuries and conditions due to external causes
T18,10,Foreign body in alimentary tract,244,Other injuries and conditions due to external causes
T16,10,Foreign body in ear,244,Other injuries and conditions due to external causes
T19,10,Foreign body in genitourinary tract,244,Other injuries and conditions due to external causes
I39,10,Endocarditis and heart valve disorders in diseases classified elsewhere,97,Peri-; endo-; and myocarditis; cardiomyopathy
N30,10,Cystitis,159,Urinary tract infections
Q60,10,Renal agenesis and other reduction defects of kidney,215,Genitourinary congenital anomalies
Q63,10,Other congenital malformations of kidney,215,Genitourinary congenital anomalies
M88,10,Osteitis deformans [Pagets disease of bone],212,Other bone disease and musculoskeletal deformities
C65,10,Malignant neoplasm of renal pelvis,33,Cancer of kidney and renal pelvis
L04,10,Acute lymphadenitis,247,Lymphadenitis
I88,10,Nonspecific lymphadenitis,247,Lymphadenitis
R59,10,Enlarged lymph nodes,247,Lymphadenitis
I82,10,Other venous embolism and thrombosis,118,Phlebitis; thrombophlebitis and thromboembolism
I81,10,Portal vein thrombosis,118,Phlebitis; thrombophlebitis and thromboembolism
N64,10,Other disorders of breast,167,Nonmalignant breast conditions
A77,10,Spotted fever [tick-borne rickettsioses],8,Other infections; including parasitic
B92,10,Sequelae of leprosy,8,Other infections; including parasitic
B99,10,Other and unspecified infectious diseases,8,Other infections; including parasitic
A79,10,Other rickettsioses,8,Other infections; including parasitic
B64,10,Unspecified protozoal disease,8,Other infections; including parasitic
B89,10,Unspecified parasitic disease,8,Other infections; including parasitic
C37,10,Malignant neoplasm of thymus,41,Cancer; other and unspecified primary
H52,10,Disorders of refraction and accommodation,89,Blindness and vision defects
Z14,10,Genetic carrier,259,Residual codes; unclassified
Z15,10,Genetic susceptibility to disease,259,Residual codes; unclassified
H22,10,Disorders of iris and ciliary body in diseases classified elsewhere,91,Other eye disorders
H21,10,Other disorders of iris and ciliary body,91,Other eye disorders
